{"authority":{"network_calls":4,"production_approved":false,"provider_calls":0,"runtime_truth":false,"source":"OWNER_REQUESTED_PUBLIC_WEBSITE_CAPTURE"},"created_at":"2026-08-26T01:40:45.340984+00:00","files":[{"bytes":4925,"media_type":"text/markdown","original_name":"website-01-summit-home-services-enhance-your-home-today-get.md","sha256":"ea5188514d6f8b121b80b3eb5c798364374ade28b6c56d6eef926442b39be404","stored_name":"website-01-summit-home-services-enhance-your-home-today-get.md"},{"bytes":2033,"media_type":"text/markdown","original_name":"website-02-about-schedule-your-home-solutions-today-summit-.md","sha256":"c9f072d02cbad88f9ca5663cb9233008226ed36dc2af9045e3c356fd4750bfde","stored_name":"website-02-about-schedule-your-home-solutions-today-summit-.md"},{"bytes":996,"media_type":"text/markdown","original_name":"website-03-faq-summit-home-services.md","sha256":"846c196525c5053477808375cf55b8061436f1c60bf20695552daf8c219af687","stored_name":"website-03-faq-summit-home-services.md"},{"bytes":477,"media_type":"text/markdown","original_name":"website-04-contact-get-in-touch-today-summit-home-services.md","sha256":"8ab9a457b07264cdca8d313691cf7a10570fdabbbe3cab02fdc865b938ddfad7","stored_name":"website-04-contact-get-in-touch-today-summit-home-services.md"}],"label":"Summit Home Services website knowledge","manifest_sha256":"d70d3d4d59cba1ad7a12b7120d6016a5422060663164860c4c25114969c06ce1","package_id":"kp-summit-home-services-website-knowledge-20260826-014045-797ab5","schema_version":"0.1","status":"INGESTED_PENDING_OWNER_APPROVAL","total_bytes":8431,"website_capture":{"captured_at":"2026-08-26T01:40:43.722066+00:00","max_pages":6,"pages":[{"source_sha256":"875759aa68757d07f76f2501eac49cfc84b10a1dc136c7aef2629d317b69603b","stored_name":"website-01-summit-home-services-enhance-your-home-today-get.md","title":"Summit Home Services | Enhance Your Home Today — Get Started Now","url":"https://www.summithomeservice.com/"},{"source_sha256":"507d1c6dea47f7907b2c7154fe3b78854575493df77c904c882342cb78e06f5a","stored_name":"website-02-about-schedule-your-home-solutions-today-summit-.md","title":"About | Schedule Your Home Solutions Today — Summit Home Services","url":"https://www.summithomeservice.com/about"},{"source_sha256":"cdb3d266135c3f0ad2006b08134981a197d805b19e1a53069675491c545779f2","stored_name":"website-03-faq-summit-home-services.md","title":"FAQ — Summit Home Services","url":"https://www.summithomeservice.com/faq-1"},{"source_sha256":"a853fa8fb683ea22620b8fcee5c205b6730144034a8ba9aedc6a0c733bb584ee","stored_name":"website-04-contact-get-in-touch-today-summit-home-services.md","title":"Contact | Get in Touch Today — Summit Home Services","url":"https://www.summithomeservice.com/contact"}],"requested_url":"https://www.summithomeservice.com/","schema_version":"0.1","scope":"SAME_ORIGIN_PUBLIC_PAGES"}}
